{"content":{"fileCount":3,"root":"content","totalBytes":114402,"treeSha256":"1A3E7EB2E084FC8213DDBEC9B71A8B28AC378EC1202725174C61926CD7AE3F80"},"contributor":{"displayName":"Treatid2","github":"Treatid2","standing":"ordinary-contributor"},"createdAt":"2026-09-22T10:58:07.095Z","licensing":{"content":"CC-BY-SA-4.0","dcoAcknowledged":true,"schemas":"CC0-1.0"},"namespace":"csx","notes":"Generic metadata observation with local-only media; no typed visual admission or quality qualification.","provenance":{"importedAt":"2026-09-22T10:58:07.095Z","relatedUrls":[],"sourceCommit":"50af8e014fc5ccd4391e451f089781175e1aebd4","sourceContentTreeSha256":"98AE4ACA96F7D707D76ACA0D2F9C5B70F6403B3419C54509A9ECE302A1A14962","sourceDirty":false,"sourceParentCommit":null,"sourcePubliclyReachable":false,"sourceRef":"locally preserved bc1cfa89 research assertion and original retained capture bundle","sourceRepository":"https://github.com/Treatid2/skyrim-render-map","sourceState":"committed-local-preservation","transformations":["Verified original tree and sequence/frame SHA256 values; reconciled SBS and eye coverage.","Top-level source content tree identifies sub-csx-fsr-colour-contract-bc1cfa89/content at the pinned research commit; sourceTreeSha256 inside corpus-index.json independently identifies the retained capture files.","Packaged original bytes with lossless DEFLATE and verified extracted hashes and decoded pixels.","Exported allowlisted metadata only; retained media and private paths locally.","Preserved drift and unavailable identities; generated no quality or Pareto judgment."]},"schema":{"major":1,"minor":0,"name":"skyrim-render-map.submission"},"status":"candidate-unreviewed","submissionClass":"observation","submissionId":"sub-csx-visual-corpus-bc1cfa89-v1"}
