{
  "schema": {
    "name": "skyrim-render-map.submission",
    "major": 1,
    "minor": 0
  },
  "submissionId": "sub-skyrim-vr-remaining-technique-routes-9935c-v1",
  "submissionClass": "assertion",
  "namespace": "skyrim-vr",
  "createdAt": "2026-09-06T00:22:24+01:00",
  "status": "candidate-unreviewed",
  "contributor": {
    "displayName": "Treatid2",
    "github": "Treatid2",
    "standing": "ordinary-contributor"
  },
  "provenance": {
    "sourceRepository": "https://github.com/Treatid2/skyrim-render-map",
    "sourceCommit": "bbb16c86963baaba41514285364031645d93d905",
    "sourceParentCommit": "e476b8cf78a87ba914963fedeb7b84dce70bff4b",
    "sourceRef": "main",
    "sourceState": "merged",
    "sourcePubliclyReachable": true,
    "sourceDirty": false,
    "importedAt": "2026-09-06T00:22:24+01:00",
    "sourceContentTreeSha256": "75CCEF0F7235EAA198222E3E27C2908A943FE256AD7A44C392BA4BE59C9879EF",
    "transformations": [
      "Declared the three remaining technique identities from the engine map, derived a bounded submission-local OBB shader-family identity from concordant named function and family-scoped technique records, and normalized their identity fields plus the OBB SetupTechnique path to BSShader::BeginTechnique."
    ],
    "relatedUrls": [
      "https://github.com/ParticleTroned/skyrim-community-shaders/pull/55",
      "https://github.com/Treatid2/skyrim-render-map/tree/bbb16c86963baaba41514285364031645d93d905/submissions/2026/08/sub-csx-full-render-exploration-9935c5210",
      "https://github.com/Treatid2/skyrim-render-map/pull/8",
      "https://github.com/Treatid2/skyrim-render-map/pull/10"
    ]
  },
  "licensing": {
    "content": "CC-BY-SA-4.0",
    "schemas": "CC0-1.0",
    "dcoAcknowledged": true
  },
  "content": {
    "root": "content",
    "fileCount": 2,
    "totalBytes": 20984,
    "treeSha256": "9E9A4AD76601E4C32D825F78699BEE0826B72CC6CEDC19847E8DF96E35A08694"
  },
  "notes": "Completes identity coverage for all nine imported technique records and connects the OBB occlusion-testing SetupTechnique route to the shared BeginTechnique spine. The OBB shader-family entity has no asserted numeric type. ImageSpace and OBB descriptor pairs both use numeric 0/0 but remain distinct family-scoped identities."
}
