{
  "schema": {
    "name": "skyrim-render-map.submission",
    "major": 1,
    "minor": 0
  },
  "submissionId": "sub-skyrim-vr-technique-identities-9935c-v1",
  "submissionClass": "assertion",
  "namespace": "skyrim-vr",
  "createdAt": "2026-09-06T00:17:12+01:00",
  "status": "candidate-unreviewed",
  "contributor": {
    "displayName": "Treatid2",
    "github": "Treatid2",
    "standing": "ordinary-contributor"
  },
  "provenance": {
    "sourceRepository": "https://github.com/Treatid2/skyrim-render-map",
    "sourceCommit": "bbb16c86963baaba41514285364031645d93d905",
    "sourceParentCommit": "e476b8cf78a87ba914963fedeb7b84dce70bff4b",
    "sourceRef": "main",
    "sourceState": "merged",
    "sourcePubliclyReachable": true,
    "sourceDirty": false,
    "importedAt": "2026-09-06T00:17:12+01:00",
    "sourceContentTreeSha256": "75CCEF0F7235EAA198222E3E27C2908A943FE256AD7A44C392BA4BE59C9879EF",
    "transformations": [
      "Normalized shader-family membership, exact vertex/pixel descriptor pairs, pixel-shader suppression state, and the one explicitly decoded technique name for the six techniques declared by the preceding render-phase selection tranche."
    ],
    "relatedUrls": [
      "https://github.com/ParticleTroned/skyrim-community-shaders/pull/55",
      "https://github.com/Treatid2/skyrim-render-map/tree/bbb16c86963baaba41514285364031645d93d905/submissions/2026/08/sub-csx-full-render-exploration-9935c5210",
      "https://github.com/Treatid2/skyrim-render-map/pull/8",
      "https://github.com/Treatid2/skyrim-render-map/pull/9"
    ]
  },
  "licensing": {
    "content": "CC-BY-SA-4.0",
    "schemas": "CC0-1.0",
    "dcoAcknowledged": true
  },
  "content": {
    "root": "content",
    "fileCount": 1,
    "totalBytes": 24968,
    "treeSha256": "7F120F766208BD017F60480B7961A74E665E680AE17D72ECE73888EA2036BBB1"
  },
  "notes": "This tranche separates stable technique identity fields from stage flags and defines. Shader-family links are correlated from the imported decoded technique records; descriptor pairs and pixel-shader suppression are runtime-capture facts. Only technique 0002 carries an explicit decoded name in the source artifact."
}
