{
  "schema": {
    "name": "skyrim-render-map.submission",
    "major": 1,
    "minor": 0
  },
  "submissionId": "sub-skyrim-vr-render-phase-selection-9935c-v1",
  "submissionClass": "assertion",
  "namespace": "skyrim-vr",
  "createdAt": "2026-09-06T00:13:30+01:00",
  "status": "candidate-unreviewed",
  "contributor": {
    "displayName": "Treatid2",
    "github": "Treatid2",
    "standing": "ordinary-contributor"
  },
  "provenance": {
    "sourceRepository": "https://github.com/Treatid2/skyrim-render-map",
    "sourceCommit": "bbb16c86963baaba41514285364031645d93d905",
    "sourceParentCommit": "e476b8cf78a87ba914963fedeb7b84dce70bff4b",
    "sourceRef": "main",
    "sourceState": "merged",
    "sourcePubliclyReachable": true,
    "sourceDirty": false,
    "importedAt": "2026-09-06T00:13:30+01:00",
    "sourceContentTreeSha256": "75CCEF0F7235EAA198222E3E27C2908A943FE256AD7A44C392BA4BE59C9879EF",
    "transformations": [
      "Declared thirteen submission-local render-phase and technique identities, then normalized seven runtime-observed phase-to-technique selection relations without inferring semantic phase names or additional descriptor properties."
    ],
    "relatedUrls": [
      "https://github.com/ParticleTroned/skyrim-community-shaders/pull/55",
      "https://github.com/Treatid2/skyrim-render-map/tree/bbb16c86963baaba41514285364031645d93d905/submissions/2026/08/sub-csx-full-render-exploration-9935c5210",
      "https://github.com/Treatid2/skyrim-render-map/pull/8"
    ]
  },
  "licensing": {
    "content": "CC-BY-SA-4.0",
    "schemas": "CC0-1.0",
    "dcoAcknowledged": true
  },
  "content": {
    "root": "content",
    "fileCount": 2,
    "totalBytes": 17256,
    "treeSha256": "6D5FF298F35CE01A2EB2EC65F66B92762BD182513B7C67DABBA2F0F95EFBC304"
  },
  "notes": "This tranche preserves the seven confirmed source relations observed for 120 frames each. It deliberately leaves semantic render-phase names, descriptor decoding, shader-family correspondence, and observation counts as separate future claims. Null scenario applicability records that the imported artifact did not publish a scenario digest; it does not assert scenario independence."
}
